{
  "schema_version": "1.0.0",
  "manifest_id": "G28-LEDGER-SOURCE-MANIFEST-R1",
  "authority": "NON-CANONICAL_DERIVED_FROM_CANONICAL_LEDGER",
  "canonical_source": "docs/ledgers/G28_LEDGER.md",
  "canonical_source_git_object": "8b7f1de1351248735d4c4945e7c3260aa77c38f5",
  "canonical_source_sha256": "f3f3651f488e64a83e33be0310fb783181e86e57fbc1c208d0c4d03268a77613",
  "canonical_byte_count": 992811,
  "canonical_line_count": 9730,
  "encoding": "UTF-8",
  "line_endings": {
    "crlf": 0,
    "lf_only": 9730,
    "bare_cr": 0,
    "mixed": false
  },
  "entry_heading_grammar": "^## YYYY-MM-DD — <non-empty title>$, plus exactly two reviewed legacy headings",
  "preamble_unit_id": "G28-LEDGER-PREAMBLE",
  "units": [
    {
      "unit_id": "G28-LEDGER-PREAMBLE",
      "unit_kind": "PREAMBLE",
      "ordinal": 0,
      "heading": null,
      "date": null,
      "phase_order_id": null,
      "start_byte": 0,
      "end_byte": 1277,
      "start_line": 1,
      "end_line": 42,
      "raw_sha256": "cbca0b498c37f3ba302fb2b71eb43b6b595797441ba06279b171b17984589a2d",
      "byte_count": 1277,
      "line_count": 42
    },
    {
      "unit_id": "G28-LEDGER-UNIT-0001",
      "unit_kind": "ENTRY",
      "ordinal": 1,
      "heading": "## 2026-07-12 — G28-B3-B5-B — Prepare technical evidence sync input",
      "date": "2026-07-12",
      "phase_order_id": "G28-B3-B5-B",
      "start_byte": 1277,
      "end_byte": 2364,
      "start_line": 43,
      "end_line": 64,
      "raw_sha256": "ccd3e83eb240a07f0095c36c669d9e6c6b3ff7eeae5e3a35b9fca593a554b7c4",
      "byte_count": 1087,
      "line_count": 22
    },
    {
      "unit_id": "G28-LEDGER-UNIT-0002",
      "unit_kind": "ENTRY",
      "ordinal": 2,
      "heading": "## 2026-07-12 — G28-DOCS-B1 — Define documentation source-of-truth model",
      "date": "2026-07-12",
      "phase_order_id": "G28-DOCS-B1",
      "start_byte": 2364,
      "end_byte": 2921,
      "start_line": 65,
      "end_line": 78,
      "raw_sha256": "af8e6bf39e0c52d22e8fb8fcd35743c431770c9610372e549e4c298810fcb57f",
      "byte_count": 557,
      "line_count": 14
    },
    {
      "unit_id": "G28-LEDGER-UNIT-0003",
      "unit_kind": "ENTRY",
      "ordinal": 3,
      "heading": "## 2026-07-12 — G28-DOCS-B2 — Cut over active documentation state ownership",
      "date": "2026-07-12",
      "phase_order_id": "G28-DOCS-B2",
      "start_byte": 2921,
      "end_byte": 3597,
      "start_line": 79,
      "end_line": 94,
      "raw_sha256": "6ef421b577b883b3d4f513b642f1c218fff6c4ef09e3d09e3cc9beb4a763c3ff",
      "byte_count": 676,
      "line_count": 16
    },
    {
      "unit_id": "G28-LEDGER-UNIT-0004",
      "unit_kind": "ENTRY",
      "ordinal": 4,
      "heading": "## 2026-07-12 — G28-DOCS-B2-R1 — Keep component state non-operational",
      "date": "2026-07-12",
      "phase_order_id": "G28-DOCS-B2-R1",
      "start_byte": 3597,
      "end_byte": 4278,
      "start_line": 95,
      "end_line": 109,
      "raw_sha256": "8980aa42335563fc20c27dc59e489ddcdf8e871827f7c4e8643083fa75943cf9",
      "byte_count": 681,
      "line_count": 15
    },
    {
      "unit_id": "G28-LEDGER-UNIT-0005",
      "unit_kind": "ENTRY",
      "ordinal": 5,
      "heading": "## 2026-07-12 — G28-DOCS-B2-CLOSEOUT — Record G28 documentation cutover acceptance",
      "date": "2026-07-12",
      "phase_order_id": "G28-DOCS-B2-CLOSEOUT",
      "start_byte": 4278,
      "end_byte": 4923,
      "start_line": 110,
      "end_line": 124,
      "raw_sha256": "0e97305e1801705eb3c8e41d79fc3f07508b2c656cd8cb668a16579a9cbe6f6e",
      "byte_count": 645,
      "line_count": 15
    },
    {
      "unit_id": "G28-LEDGER-UNIT-0006",
      "unit_kind": "ENTRY",
      "ordinal": 6,
      "heading": "## 2026-07-12 — G28-DOCS-B3-B0 — Preserve pre-model documentation snapshots",
      "date": "2026-07-12",
      "phase_order_id": "G28-DOCS-B3-B0",
      "start_byte": 4923,
      "end_byte": 5770,
      "start_line": 125,
      "end_line": 142,
      "raw_sha256": "25cc11d7becdb6908e201921e990a0316a80a719ae26991042c39394873b8a68",
      "byte_count": 847,
      "line_count": 18
    },
    {
      "unit_id": "G28-LEDGER-UNIT-0007",
      "unit_kind": "ENTRY",
      "ordinal": 7,
      "heading": "## 2026-07-12 — G28-DOCS-B3-C — Replace active histories with immutable snapshot references",
      "date": "2026-07-12",
      "phase_order_id": "G28-DOCS-B3-C",
      "start_byte": 5770,
      "end_byte": 6478,
      "start_line": 143,
      "end_line": 158,
      "raw_sha256": "b19713e8a2318990163b04a785727228748c5db0252ca27434b9a1992cdac0d9",
      "byte_count": 708,
      "line_count": 16
    },
    {
      "unit_id": "G28-LEDGER-UNIT-0008",
      "unit_kind": "ENTRY",
      "ordinal": 8,
      "heading": "## 2026-07-12 — G28-DOCS-B3-C-CLOSEOUT — Record immutable history cutover acceptance",
      "date": "2026-07-12",
      "phase_order_id": "G28-DOCS-B3-C-CLOSEOUT",
      "start_byte": 6478,
      "end_byte": 7000,
      "start_line": 159,
      "end_line": 172,
      "raw_sha256": "dc464bd72dccd09898079a8a6356a93ee3e9e3847f814dfa606ef3af734abe5c",
      "byte_count": 522,
      "line_count": 14
    },
    {
      "unit_id": "G28-LEDGER-UNIT-0009",
      "unit_kind": "ENTRY",
      "ordinal": 9,
      "heading": "## 2026-07-12 — G28-DOCS-B3-D1 — Bootstrap prospective G28 phase ledger",
      "date": "2026-07-12",
      "phase_order_id": "G28-DOCS-B3-D1",
      "start_byte": 7000,
      "end_byte": 7882,
      "start_line": 173,
      "end_line": 187,
      "raw_sha256": "31d0285cb73d4f6d31b1b00172349ee62128258fd6505702fec8bb1bf7cac1b0",
      "byte_count": 882,
      "line_count": 15
    },
    {
      "unit_id": "G28-LEDGER-UNIT-0010",
      "unit_kind": "ENTRY",
      "ordinal": 10,
      "heading": "## 2026-07-13 — G28-DOCS-B3-E1 — Documentation authority list reconciliation",
      "date": "2026-07-13",
      "phase_order_id": "G28-DOCS-B3-E1",
      "start_byte": 7882,
      "end_byte": 8673,
      "start_line": 188,
      "end_line": 205,
      "raw_sha256": "18ba0059fad42cf01b6fddb44711f4daf7128f979afb9c660c51600f4bb570d3",
      "byte_count": 791,
      "line_count": 18
    },
    {
      "unit_id": "G28-LEDGER-UNIT-0011",
      "unit_kind": "ENTRY",
      "ordinal": 11,
      "heading": "## 2026-07-13 — G28-B3-B5-C — Complete technical evidence sync integration",
      "date": "2026-07-13",
      "phase_order_id": "G28-B3-B5-C",
      "start_byte": 8673,
      "end_byte": 10332,
      "start_line": 206,
      "end_line": 234,
      "raw_sha256": "2ffbbb3a8033239fdbbbe31f3eb9a0f51c94109b6bb8490ef880ca25191743a4",
      "byte_count": 1659,
      "line_count": 29
    },
    {
      "unit_id": "G28-LEDGER-UNIT-0012",
      "unit_kind": "ENTRY",
      "ordinal": 12,
      "heading": "## 2026-07-13 — G28-B3-B5-C — CLOSED / ACCEPTED",
      "date": "2026-07-13",
      "phase_order_id": "G28-B3-B5-C",
      "start_byte": 10332,
      "end_byte": 12030,
      "start_line": 235,
      "end_line": 266,
      "raw_sha256": "03f42883d812c1c40fe69887fbf4879aed23a208374d0aee96df62afeec89966",
      "byte_count": 1698,
      "line_count": 32
    },
    {
      "unit_id": "G28-LEDGER-UNIT-0013",
      "unit_kind": "ENTRY",
      "ordinal": 13,
      "heading": "## 2026-07-13 — G28-B3-B6-B — Current technical evidence admin reader",
      "date": "2026-07-13",
      "phase_order_id": "G28-B3-B6-B",
      "start_byte": 12030,
      "end_byte": 14341,
      "start_line": 267,
      "end_line": 294,
      "raw_sha256": "20df84be16b27292206d9abb397116341978789fa8dd3d6a92ceb1456a2aba4a",
      "byte_count": 2311,
      "line_count": 28
    },
    {
      "unit_id": "G28-LEDGER-UNIT-0014",
      "unit_kind": "ENTRY",
      "ordinal": 14,
      "heading": "## 2026-07-13 — G28-B4 — DOCUMENT QUEUE",
      "date": "2026-07-13",
      "phase_order_id": "G28-B4",
      "start_byte": 14341,
      "end_byte": 16829,
      "start_line": 295,
      "end_line": 315,
      "raw_sha256": "f1cdd50f11690f838167cd9a44e8e28f483a13f484a6291c66a1f74894ab8c22",
      "byte_count": 2488,
      "line_count": 21
    },
    {
      "unit_id": "G28-LEDGER-UNIT-0015",
      "unit_kind": "ENTRY",
      "ordinal": 15,
      "heading": "## 2026-07-14 — G28-B5 — Human decision command contract and staging verification",
      "date": "2026-07-14",
      "phase_order_id": "G28-B5",
      "start_byte": 16829,
      "end_byte": 19006,
      "start_line": 316,
      "end_line": 335,
      "raw_sha256": "d406e3f85ab51bc9ec9bf3a029a7c34b3ef39ec38bcec387279a49177214da08",
      "byte_count": 2177,
      "line_count": 20
    },
    {
      "unit_id": "G28-LEDGER-UNIT-0016",
      "unit_kind": "ENTRY",
      "ordinal": 16,
      "heading": "## 2026-07-14 — G28-B5-D4-R1 — Load canonical document decision runtime modules",
      "date": "2026-07-14",
      "phase_order_id": "G28-B5-D4-R1",
      "start_byte": 19006,
      "end_byte": 21028,
      "start_line": 336,
      "end_line": 355,
      "raw_sha256": "b14a3853fd349acb6c310e03d01ae40e2678d6c75eaced927e8490ece028b194",
      "byte_count": 2022,
      "line_count": 20
    },
    {
      "unit_id": "G28-LEDGER-UNIT-0017",
      "unit_kind": "ENTRY",
      "ordinal": 17,
      "heading": "## 2026-07-14 — G28-B5-D5-A / G28-B5-D5-B1 — Explicit document source boundary",
      "date": "2026-07-14",
      "phase_order_id": "G28-B5-D5-A / G28-B5-D5-B1",
      "start_byte": 21028,
      "end_byte": 22137,
      "start_line": 356,
      "end_line": 372,
      "raw_sha256": "e79b31c77aa62d277d591d3e578ae4c0a09b41311525dd8de5d373e4cc5d4aa7",
      "byte_count": 1109,
      "line_count": 17
    },
    {
      "unit_id": "G28-LEDGER-UNIT-0018",
      "unit_kind": "ENTRY",
      "ordinal": 18,
      "heading": "## 2026-07-14 — G28-B5-D5-B2 — Harden local decision helpers and explicit legacy call sites",
      "date": "2026-07-14",
      "phase_order_id": "G28-B5-D5-B2",
      "start_byte": 22137,
      "end_byte": 23940,
      "start_line": 373,